{
  "schema_version": "branch-card/v1",
  "case_id": "after_chapter_16",
  "branch_id": "branch_02",
  "core_mechanism": "两颗珠子坠地碎裂后，鬼瞳鬼耳让陈默发现一只烧伤的女播音员鬼正借宿舍墙内废弃广播线路侵入王冬的电脑并诱使他走向窗口；陈默主动砸毁王冬珍爱的电脑切断这一处出口，以财物损失和室友情谊破裂为代价救下王冬，却只能阻断单个终端，无法消除仍沿整座校园广播线路扩散的鬼物。",
  "premise_difference": "灵异问题通过校园遗留的有线广播系统扩散，恐怖场面集中在断电电脑自行播放、屏幕倒影显鬼和睡梦中的王冬被音频牵引；人物转折不是陈默接受鬼物条件，而是他明知王冬会把自己当成毁坏心爱设备的混蛋，仍选择亲手毁掉朋友的财物。",
  "character_choice": "陈默确认拔电源、关总闸都无法停止声音，而电脑屏幕上每增加一道裂痕，王冬的脚步就会短暂停顿。他可以保住王冬最珍爱的电脑并冒险继续寻找温和办法，也可以立刻彻底砸碎屏幕和主机救人；他选择后者，并决定不向普通室友公开鬼瞳鬼耳，独自承受误解。",
  "real_cost": "电脑与显示器在本单元内被陈默亲手砸坏，王冬清醒后拒绝接受含糊解释，当场要求陈默照价赔偿、停止替他带饭洗衣并不再与他组队；陈默既背上现实债务，也失去原本亲密的室友信任，而由于不能说出地府能力，关系无法立即修复。",
  "world_rule_usage": "珠子落地碎裂后，鬼瞳令陈默看见断电屏幕倒影中半身焦黑、手指粘着磁带的女鬼及缠在王冬四肢上的黑色声纹，鬼耳则把普通人只能当作电流杂音的催眠播音辨成清晰鬼语；两种能力只有感知作用，不提供攻击、防护或驱散手段。",
  "beats": {
    "setup": "两颗珠子摔碎，阴冷气息分别没入陈默眼耳。他从睡梦中惊醒，发现王冬那台已经关机的电脑自行亮起雪花，耳机漏出失真的午夜节目；鬼瞳进一步显出屏幕倒影里一名烧伤女播音员鬼，鬼耳则听清她正在诱导王冬起身靠近敞开的窗口。",
    "escalation": "陈默用嘴贫压住惊恐，先拔掉电源、再拉下寝室总闸，雪花和声音却沿墙内线路继续。王冬始终无法被唤醒，已经跨过窗边护栏。陈默在搬动电脑时碰裂屏幕一角，发现女鬼影像短暂扭曲、王冬也随之停步，从而确认这台电脑是当前最强的出口。",
    "irreversible_choice": "陈默没有继续赌时间，而是在王冬珍爱的整套电脑与他的生命安全之间做出选择，亲手将显示器砸落并踹坏主机。这个动作彻底毁掉朋友财物，也让王冬醒来后只能把他视为肇事者。",
    "local_payoff": "电脑彻底黑屏，缠住王冬的黑色声纹断裂，他从护栏边跌回寝室而没有坠下。女鬼从碎屏中消失，王冬只看到陈默站在残骸旁；陈默以夸张借口掩盖神通与鬼物，保住室友性命和普通人的认知边界，却当场失去王冬的信任。",
    "end_hook": "短暂安静后，鬼耳从墙体深处听见同一段节目沿多条线路重新开播，鬼瞳也在对面寝室的黑屏上看见女鬼逐个显形；走廊随即响起数名学生整齐离床的脚步，而节目预告黎明前将在封闭多年的校园广播室完成最后一段播送。"
  },
  "freedom_budget_choices": {
    "ghost_identity": "女鬼生前是校园广播站的学生播音员，死于一次设备间火灾，焦黑外观与磁带残片构成可被鬼瞳确认的具体形象。",
    "campus_old_story": "火灾后广播室被封闭，但部分有线线路仍埋在教学楼和宿舍墙内，形成鬼物长期近在身边却不被普通人察觉的传播路径。",
    "first_negotiation": "女鬼借电脑音频要求陈默接通校园网络、帮助她完成未播完的节目，并以继续牵引王冬相逼；陈默拒绝合作，选择毁掉当前出口救人。"
  },
  "idea_lock_evidence": {
    "两种神通必须因珠子落地而生效": "setup 明确以两颗珠子落地碎裂为起点，阴冷气息进入眼耳后，陈默才首次获得对应感知。",
    "能力必须让陈默看见或听见具体鬼物": "setup 和 world_rule_usage 分别落实女播音员鬼的焦黑形象、磁带残片、催眠播音与可辨识鬼语，鬼瞳和鬼耳各有独立事件功能。",
    "附近灵异问题不能在本单元被轻易消灭": "local_payoff 只关闭王冬电脑这一处出口，end_hook 明确女鬼仍沿校园线路进入其他终端，并把下一场危机锁定在黎明前的封闭广播室。"
  },
  "forbidden_change_checks": {
    "神通失效或只是梦境": "未发生；王冬醒来、电脑损毁后，陈默仍能看见对面黑屏中的女鬼并听见墙内节目，能力与危机均持续。",
    "突然新增无关战斗技能": "未发生；陈默只靠普通人的观察和破坏现有电脑阻断局部出口，没有获得任何攻击鬼物的能力。",
    "让普通室友立刻完全知情": "未发生；王冬只知道自己在窗边醒来且电脑被陈默砸坏，陈默用含糊借口遮住神通、女鬼和校园线路真相。"
  },
  "risk_register": [
    "风险：破坏电脑若缺少预先验证，会像任意规则解决危机；规避：先展示断电无效、屏幕开裂却同步削弱牵引，让最终选择建立在可观察因果上。",
    "风险：女鬼沿广播线路扩散可能膨胀成未经授权的宏大设定；规避：将传播范围限制在本校遗留有线系统，不推导通用电子鬼规则。",
    "风险：王冬的愤怒若很快消除，人物代价会失真，嘴贫也可能冲淡恐怖；规避：本单元落实赔偿、互助中止和拒绝组队，且只让笑点承担压惊与遮掩功能。"
  ]
}
