{
  "schema_version": "branch-card/v1",
  "case_id": "after_chapter_16",
  "branch_id": "branch_03",
  "core_mechanism": "鬼瞳让陈默看见一名拿着旧点名册的学生鬼始终齐膝陷在现宿舍地面下、沿着一条穿过家具的旧过道行走，鬼耳则让他听清鬼物反复点的是废弃寝号与“缺少四号床”；他据此把闯寝索命重新理解为旧宿舍格局被翻修封在现地板下后仍在继续的残缺查寝，改用指出错位寝号并追问缺席者来中止当夜点名，却也因此被鬼物登记为下一轮的临时代答者。",
  "premise_difference": "首次见鬼不是单纯跳吓或打鬼，而是让视觉中的空间错位与听觉中的旧名册互相校正：鬼物一直就在床边，只是它行走于被新地面覆盖的旧楼层；识破其目标后可以暂缓伤人，却不能消除地板下尚未补齐的“第四床”问题。",
  "character_choice": "当熟睡的王冬被旧名字诱得即将应声时，陈默没有独自逃离，而是捂住室友的嘴并主动回应鬼物，以自己暴露在点名规则中的代价指出它找错了现寝室、追问原来的四号床，从而把第一次接触由躲避改为交涉。",
  "real_cost": "鬼物用冰冷手指在陈默手腕按下一个整夜不退的黑色“四”字，皮肤当场出现冻伤般的肿痛；标记使它下一次点名会先找陈默，这一身体伤害与被锁定状态都在本单元真实发生。",
  "world_rule_usage": [
    "两颗珠子因陈默睡梦中扔落地面而同时摔碎，碎片化成黑气分别入眼入耳，鬼瞳与鬼耳立即生效且醒后持续，排除梦境和失效解释。",
    "鬼瞳承担“可观阴阳、可辨鬼物”的事件展示：陈默看见鬼物、旧点名册、低于现地面的腿部位置与穿过家具的行走路线。",
    "鬼耳承担“可听鬼言、可辨鬼语”的事件展示：陈默听懂废弃寝号、旧人名、“四号床缺席”及下一轮点名警告；普通室友只能在睡梦中含混应声，无法获得完整信息。",
    "点名、代答标记与旧格局只限定为这名鬼物的执念和校园局部问题，不上升为所有鬼物通用的新核心规则。"
  ],
  "beats": {
    "setup": "两颗珠子落地爆裂，黑气入眼入耳把陈默从睡梦中疼醒；他先听见宿舍里有人用沙哑声音点名，睁眼后看见一名穿旧式校服、拿残破名册的学生鬼从桌子中间穿过，双腿却像埋在地板下一样只露到膝盖。",
    "escalation": "陈默缩在被窝里用查寝走错门、阴间也该看门牌之类的嘴贫压住恐惧，却发现鬼物点的寝号和姓名都不属于现在；当它念到缺席的四号床时，熟睡的王冬竟含混要应声。陈默捂住王冬的嘴，鬼物随即转向唯一能听懂它的陈默，室友则只短暂惊醒并把动作当成陈默梦游恶作剧。",
    "irreversible_choice": "陈默注意到鬼物每一步都低于现地面、路线笔直穿过后来添置的床桌，判断它不是从门外闯入，而是在重复被翻修覆盖前的旧过道。他放弃叫醒王冬共同逃跑，主动出声指出这里已不是名册上的旧寝号，并追问“原来的四号床在哪”，由此承接鬼物注意；鬼物在他手腕留下黑色四号标记。",
    "local_payoff": "鬼物第一次停止机械点名，指向陈默床下与墙角相接的一道被新地板盖住的旧门槛痕迹，并断续表明自己是旧楼层长，当年事故夜始终少了一名四号床学生。陈默准确说出它点的旧寝号后，鬼物接受“今夜查错房”的说法，放过王冬并退入地板；鬼瞳鬼耳通过看见、听懂、交涉完整兑现，但没有消灭鬼物。",
    "end_hook": "鬼物沉下去前警告下一次点名会由手腕上的“四号”先作答；紧接着，陈默床下被封死的地板深处传来第四下敲击，位置正对应旧名册上缺失的床位，使他必须在下一夜前查清被翻修掩埋的旧寝室事故。"
  },
  "freedom_budget_choices": {
    "鬼物身份": "选择一名困在事故夜查寝执念中的旧楼层长学生鬼，外形、名册与重复点名均服务于同一局部机制。",
    "校园旧事": "现宿舍翻修时抬高地面并覆盖了一段旧寝室格局，事故记录中四号床学生缺席且去向未明；本单元只由空间痕迹和鬼物残句建立，不一次性给出完整真相。",
    "第一次交涉": "陈默用恐惧下的嘴贫试探，随后依据寝号与地面错位指出查错房，换得当夜暂停点名；代价是自己被登记为下一轮四号。"
  },
  "idea_lock_evidence": [
    {
      "idea_lock": "两种神通必须因珠子落地而生效",
      "beat": "setup",
      "evidence": "两珠被睡梦中的陈默扔落后同时摔碎，黑气入眼入耳，视觉与听觉能力在同一现场立即启动。"
    },
    {
      "idea_lock": "能力必须让陈默看见或听见具体鬼物",
      "beat": "setup / escalation / local_payoff",
      "evidence": "陈默清楚看见拿旧名册的学生鬼及其错位行走，也听懂它点出的寝号、人名和四号床警告，并与其完成一次有效交涉。"
    },
    {
      "idea_lock": "附近灵异问题不能在本单元被轻易消灭",
      "beat": "end_hook",
      "evidence": "鬼物只暂停当夜点名并退回地板，陈默已被标记，床下仍有回应敲击，下一夜的具体期限继续逼近。"
    }
  ],
  "forbidden_change_checks": [
    {
      "forbidden_change": "神通失效或只是梦境",
      "check": "珠子确实破碎、能力醒后持续，手腕冻伤和床下敲击留下客观后果。"
    },
    {
      "forbidden_change": "突然新增无关战斗技能",
      "check": "陈默没有攻击鬼物，解决当夜危险只靠鬼瞳观察、鬼耳理解和针对线索的交涉。"
    },
    {
      "forbidden_change": "让普通室友立刻完全知情",
      "check": "王冬看不见也听不懂鬼物，只在半睡半醒间把被捂嘴当作陈默梦游，未获知地府资源或灵异全貌。"
    }
  ],
  "risk_register": [
    "风险：旧楼层与点名标记可能膨胀成未经授权的宏大世界观；规避：将其限定为本宿舍翻修事故和单个鬼物的执念，不定义普遍鬼界法则。",
    "风险：鬼物因一句“走错房”就退去会显得危机过于容易解决；规避：退去仅暂停当夜流程，陈默付出冻伤与四号标记，且床下敲击证明真正问题仍未解决。",
    "风险：嘴贫可能冲淡恐怖，王冬的梦中应声也可能被误读为完全知情；规避：吐槽只用于压惊和试探，恐怖由空间错位、冻伤与敲击维持，并明确王冬醒后只记得陈默捂嘴。"
  ]
}
